,Text
1849,"AutoLink functions by generating a hyperlink to a website based on the content found in a webpage, even if no link is explicitly provided and regardless of the page's publisher granting permission."
1850,Some users have likened the new tool to Microsoft's Smart Tags feature.
1851,"For those who have shunned free peer-to-peer services, downloading music can become an expensive endeavor."
1852,"Paul Myers, chief executive of Wippit, a UK-based music download service, stated that music fans are shifting away from purchasing traditional bundled albums to newer options like single tracks or subscription services that better suit their lifestyle."
1853,"Some digital music enthusiasts are upset about this, particularly because Napster already provides a more affordable option for downloading music to the PC."
1854,"At his annual MacWorld speech in San Francisco, Chief executive Steve Jobs introduced a new, affordable Macintosh computer called the Mac mini, targeting a wider audience."
1855,"The company's new computer marks a shift into uncharted territory - traditionally, the firm is recognized for its design and innovation focus rather than as a mass-market manufacturer."
1856,Harris stated that they are interested in trying out Mac further because they are impressed by what they have seen with iPod.
1857,The high-tech sector is becoming increasingly conscious of environmental issues. Bill Thompson believes it is long overdue.
1858,"In addition to reducing the use of toxic materials like arsenic, mercury, cadmium, and other heavy metals in the products themselves, efforts are being made to clean up the manufacturing process by using fewer complex and potentially damaging organic chemicals as solvents."
1859,"If they construct items that are costly or difficult to dismantle, they will ultimately bear the cost and see their profits decline, likely motivating them when appeals to the broader public interest are ineffective."
1860,"Just now, I surveyed my office and discovered two monitors, an old 386 PC, two old handhelds, three ancient laptops, four antique mobile phones, a collection of rechargeable batteries, and even a Sun workstation that is no longer of much use."
1861,"Analysts have predicted that Asia will drive global media growth to 2008 and beyond, with China and India taking the top two spots."
1862,"Over 700 million Chinese tune in to 1,000 radio stations, while 200 TV stations air 2,900 channels."
1863,"Chinese and foreign entrepreneurs are eyeing opportunities in new media, such as mobile services and online gaming, in addition to traditional broadcasting, with mobile games already contributing significantly to revenues from China's vast mobile user base."
1864,"Aid workers in the Sudanese region of Darfur are receiving assistance from advanced mapping technology to support their efforts in housing, feeding, and clothing millions of homeless refugees."
1865,"The group utilizes satellites from Nasa, the European Space Agency, and the Disaster Monitoring Constellation."
1866,Humanitarian organizations in Darfur have been effectively utilizing Respond's maps.
1867,"When you tune into the radio in the US, you are likely to come across a lot of Spanish-language music."
1868,"Manuel Millan, a San Diego native, explains that accessing hip-hop in Spanish on mainstream radio is not easy."
1869,Spanish language hip-hop may find the web to be the perfect platform at this moment.
1870,"Clark Boyd serves as the technology correspondent for The World, a collaboration between BBC World Service and WGBH-Boston."
1871,Nintendo has officially launched its DS handheld game console in Europe.
1872,"Since the end of 2004, Nintendo has sold nearly 4 million DS consoles after they were released in Japan and the US."
1873,"In addition to featuring two screens, one of which is touch-controlled, the DS allows players to engage with up to 16 other individuals wirelessly."
1874,"Bioware, a video game company known for titles like Knights of the Old Republic and Neverwinter Nights, is holding open auditions for individuals to potentially become cast members in their upcoming games."
1875,"Shauna Perry, Bioware's audio and external resources producer, mentioned that there are numerous characters in a typical Bioware game, residing in various cities and villages, requiring a diverse range of faces."
1876,"Carly Fiorina, the chief of technology giant Hewlett Packard, stated that the digital revolution is centered on enabling individuals to share their own stories."
1877,"Ms Fiorina also highlighted the importance of technology being tailored to lifestyle, fashion, and personalization, which she believes is crucial to meeting people's preferences."
1878,"One of the new products she presented was the Digital Media Hub, a significant upgrade to HP's Digital Entertainment Centre."
1879,"Television began as a mystical, blurry image."
1880,"However, European TV viewers will have to wait to experience the eye-popping high-definition images."
1881,"BSkyB, a satellite broadcaster in the UK, is preparing to launch HDTV services in 2006."
1882,Microsoft is cracking down on individuals using pirated versions of its Windows operating system by limiting their access to security features.
1883,Those attempting to manually download security patches must either allow Microsoft to conduct an automated checking procedure on their computer or provide an identification number.
1884,Virus writers heavily exploit Microsoft's Windows operating system due to its widespread use and constant search for new security vulnerabilities to exploit.
1885,Two gamers from the UK are preparing to start a global tour as participants in the most profitable international gaming competition ever.
1886,The CPL World Tour is set to begin in mid-February with the first leg scheduled in Istanbul.
1887,Companies are increasingly failing to maintain the security of their wireless data networks.
1888,Wireless or wi-fi networks have gained significant popularity in office settings over the past few years due to their ease of setup and enhanced convenience for online access.
1889,"Nokia is planning to test a wireless ticket system on German buses, which could allow mobile phones to also serve as travel cards in the near future."
1890,Transport systems worldwide are recognizing the benefits of utilizing ticketless smartcards.
1891,"E-business experts warn that fake bank e-mails, also known as phishing, and stories about ID theft are hindering the potential of online commerce."
1892,"Barry Beal, the global security manager for Capgemini, informed the BBC News website that he does not believe the threat is exaggerated."
1893,"Activcard, along with companies like RSA Security, has been working on developing a solution."
1894,Delegates at the world's largest gadget show in Las Vegas have been informed that the surge in consumer technology will persist into 2005.
1895,"The display of portable technologies at CES also highlighted the concept of ""time and place shifting"" of multimedia content, enabling users to enjoy video and music anywhere, at any time."
1896,"At the exhibition, there was an abundance of color and plasma screens, including Samsung's 102-inch (2.6 meter) plasma - the largest in the world."
1897,Virus creators are now leveraging the internet to disseminate their harmful software.
1898,"Bofra, the virus that employs this technique, belongs to the family of worms and made its first appearance on 10 November."
1899,The BBC News website displayed messages with bright yellow and green backgrounds.
1900,"According to Tim Warner, who is a spokesperson for the anti-virus firm Finjan, individuals are now becoming increasingly creative in their methods of spreading viruses."
1901,"Sony's Blu-ray Disc technology has received a significant endorsement from film giant Disney, which plans to use it for future DVD production."
1902,"The ongoing battle for Hollywood's hearts and minds is critical due to the potential billions in revenue that high-definition films could generate, prompting studios to prefer a single standard."
1903,"A study predicts that by 2025, 40% of the UK's population will continue to lack internet access at home."
1904,The study urges the government and telecoms industry to devise new strategies to attract those left behind by the digital revolution.
1905,"Currently, the most disadvantaged groups, including the older generation and the disabled, are likely to remain among low-income families."
1906,"Cebit is the ultimate destination for technology enthusiasts, with thousands of products and tens of thousands of visitors."
1907,"Among the halls, there are restaurants, shops, and a bus service, totaling 27 in number."
1908,"The PC offers home entertainment, movies, or music and can also be connected to the car outside, equipped with its own processor, a DVD player, and wireless headphones for the kids in the back."
1909,"Koji Umemoto, manager of mobile terminals marketing for NEC, mentioned that the train station is likely the most suitable location for the application, such as checking the soccer game status."
1910,"Creative, a portable media player firm, unveiled a new wireless technology based on magnetic inductance rather than radio, similar to systems used in some hearing aids."
1911,The initial Blinx was designed to attract numerous platform game enthusiasts to Microsoft's recently launched Xbox console.
1912,The detailed character generator allows you to create a unique personality for the game with just a few minutes of tweaking and adjusting.
1913,"Regrettably, the puzzles are clearly highlighted, making it more of a task than a test for most gamers to solve them."
1914,"In Las Vegas, the annual Consumer Electronics Show (CES) has attracted thousands of technology enthusiasts and industry professionals."
1915,"The main focus of this year's show will be on technologies that empower individuals to control multimedia content, enabling them to store, listen to, and watch their desired content on devices anytime, anywhere."
1916,The CEA forecasted that there would be various key technology trends to monitor in the upcoming year.
1917,"For individuals who have avoided using free peer-to-peer services, downloading music can become an expensive endeavor."
1918,"Paul Myers, chief executive of Wippit, a UK-based music download service, mentioned that music fans are shifting away from purchasing traditional bundled albums to newer options like single tracks or subscription services that better suit their lifestyle."
1919,"Some digital music lovers are outraged by this, particularly because Napster already provides a more affordable service for downloading music to the PC."
1920,"Blogs, which are online diaries, are prevalent, with an estimated five million on the web and this number is expected to increase."
1921,The rise of the blogging movement has been happening for many years.
1922,"Some sections of the traditional media have raised concerns about this new competitor, questioning the journalistic value of blogs."
1923,It appears improbable that we will live in a world where every person is a blogger.
1924,The UK government is launching a rapid alerting service called IT Safe to inform home computer users about serious internet security issues.
1925,Employing full-time staff to analyze the numerous alerts issued annually by computer security firms to identify those with the potential to impact a large number of individuals.
1926,More than half of UK households are reported to own a home computer according to government statistics.
1927,"According to Carly Fiorina, the head of technology giant Hewlett Packard, the focus of the digital revolution is to empower individuals to share their own stories."
1928,"Ms Fiorina highlighted the importance of technology being tailored to lifestyle, fashion, and personalization, which she believes aligns with consumer preferences."
1929,"One of the new products she presented was the Digital Media Hub, a significant upgrade to HP's Digital Entertainment Centre."
1930,"For ""security reasons,"" overseas users are being prevented from visiting the official re-election site of President George W Bush."
1931,The decision to prevent foreign visitors from accessing the site is believed to have been made in response to an attack on the georgewbush.com website.
1932,"The net monitoring firm Netcraft discovered the international exclusion zone surrounding georgewbush.com, noting that attempts to access the site from monitoring stations in London, Amsterdam, and Sydney had failed since the early hours of 25 October."
1933,"Scandinavians and Koreans, two of the most adventurous groups of mobile users, are embracing mobile TV."
1934,"SK Telecom from South Korea, which is set to introduce a TV to mobile service via satellite in May, plans to charge a flat fee of $12 per month for its 12 video channels and 12 audio channels."
1935,"However, the mobile TV arena is not as simple and straightforward as it may seem."
1936,Digital Audio Broadcasting may offer a good compromise and improved sound quality compared to traditional radio for mobile users who are skeptical about watching TV on their phones.
1937,Security researchers have discovered that over one million computers connected to the internet have been hijacked for malicious purposes such as attacking websites and distributing spam and viruses.
1938,"The Honeynet Project, a group of security researchers, conducted a thorough examination of zombie or 'bot nets comprised of hijacked computers."
1939,"The months of surveillance have shown that various 'bot nets, ranging from a few hundred to tens of thousands of machines, are utilized for different purposes."
1940,High-speed internet connections in the UK are becoming increasingly popular.
1941,"Based on data collected by industry regulator Ofcom, the UK has now exceeded Germany in terms of broadband users per 100 people."
1942,"According to its creators, the upcoming official release of Opera 8.0, scheduled for the end of next month, will be hailed as ""the most user-friendly browser on the market."""
1943,"A feature that may be attractive to individuals with low vision is the ability to adjust page size to fit the screen width, eliminating the need for horizontal scrolling."
1944,The FBI has issued a warning about a computer virus being spread through emails claiming to be from the FBI.
1945,"In a statement, the FBI informed that individuals receiving such solicitations should be aware that the bureau does not send unsolicited emails to the public in this way."
1946,"With the release of its next generation of digital music players, Apple has expanded its iPod family."
1947,"In 2004, approximately 25 million portable players were sold, with 10 million being Apple iPods."
1948,They are also beginning to utilize them in innovative ways.
1949,A new battleground is about to emerge in the ongoing rivalry between Microsoft and Google.
1950,"During a call with financial analysts to discuss its first quarter results, Microsoft announced its upcoming search software."
1951,"Recently, several other companies have also introduced desktop search systems."
1952,Desktop search has gained significance for various reasons.
1953,"The mobile gaming industry is poised for a significant growth in 2005, with various high-profile devices offering a range of gaming and multimedia features."
1954,"Hoping to maintain its dominance in the competitive mobile gaming market, the Japanese gaming giant is banking on the success of the DS."
1955,"Using the provided stylus for aiming, the game can be controlled."
1956,"The Crystal Harmony luxury cruise liner, located in the Gulf of Mexico, is an unexpected location for testing biometric technology."
1957,"Authenti-corp, the US technology consultancy, has collaborated with the ILO on its technical specifications for the cards."
1958,"Two US firms, ScanSoft and Gracenote, are working on technology that will allow music and film fans to control their digital media players simply by speaking to them."
1959,Gracenote offers music library information for millions of albums to jukeboxes like Apple's iTunes.
1960,Microsoft is launching tools to clean up computers infected with viruses and spyware.
1961,"The anti-spyware tool is currently available, while the anti-virus utility is expected to be available later this month."
1962,Security companies are alerting people to a Windows virus that is pretending to be an electronic Christmas card.
1963,"Similar to many other Windows viruses, Zafi-D searches Microsoft Outlook for email addresses and then utilizes mail-sending software to distribute itself to new victims across the web."
1964,"A report from analysts Gartner predicts that by the end of 2004, four times as many mobiles with cameras will be sold in Europe compared to last year."
1965,"When camera phones were first introduced, they faced initial challenges such as poor image quality and difficulties in sending pictures via MMS, but these issues have improved in the last 18 months."
1966,Images captured by mobile phone cameras have even found their way into the art world.
1967,"The total amount of junk e-mail has increased by 40%, reaching an impressive 90%, as reported by e-mail management firm Email Systems."
1968,"Not only multi-nationals are at risk of denial of service attacks, where websites are overwhelmed with requests and become inaccessible."
1969,Guests at the British Library can access wireless internet in addition to the vast information offered in its renowned reading rooms.
1970,The study discovered that many individuals were previously leaving the building to visit a nearby internet café in order to access their e-mail.
1971,"According to an expert panel at the annual Consumer Electronics Show in Las Vegas, the way people watch TV will undergo a radical change in five years, as home theatre systems, plasma high-definition TVs, and digital video recorders become more prevalent in living rooms."
1972,Digital and personal video recorders (DVR and PVR) have been one of the most discussed technologies at CES.
1973,"Stacey Jolna, the senior vice president of TV Guide TV group, explained that simplifying the way people find the content they want to watch is crucial for TV viewers."
1974,"According to web analysts, the percentage of surfers using Microsoft's Internet Explorer (IE) has fallen below 90%."
1975,"According to the figures, Mozilla browsers, including Firefox 1.0, now hold a market share of 7.4%."
1976,Many gadget enthusiasts are storing the digital equivalent of 10 trucks full of paper due to their insatiable appetite for data.
1977,"If the current trend of digital hoarding persists, individuals may be lugging around a ""digitally obese"" 20 gigabytes by next year."
1978,"Memory keys and memory sticks are proving to be insufficient for storing all the necessary data, as many are discovering."
1979,"As mobile phones become increasingly common as all-in-one media players, the importance of audio is growing."
1980,"A variety of basic technologies are available that enhance sound quality, making headphones more appealing."
1981,The technology operates by utilizing the science of psychoacoustics and originated from medical research conducted by the company's research director Dr Alastair Sibbald.
1982,"Virgin Radio, in collaboration with technology firm Sydus, will be the first station globally to provide radio through 3G mobiles."
1983,Mr Cridland mentioned that this application will allow individuals to listen to Virgin Radio from anywhere using just the phone in their pocket.
1984,"Nintendo has announced that its new handheld console, the DS, will be released in Europe on 11 March."
1985,"Nintendo has confirmed that the European launch date will feature 15 games, including Super Mario 64 DS and titles from third-party developers like Ubisoft's Rayman DS."
1986,"According to John Houlihan, editor of Computerandvideogames.com magazine, the launch price of £99 (149 euros) is favorable compared to the US price of $149."
1987,"Historically, games consoles and handhelds have typically been released in Europe later than in other regions of the world."
1988,The state of Texas has initiated legal proceedings against two individuals suspected to be among the top five spammers globally.
1989,"A University of Texas student, Ryan Samuel Pitylak, and Mark Stephen Trotter of California were named in the Texas lawsuit as the top executives of three companies suspected of sending out millions of unwanted e-mail messages."
1990,Intel has revealed findings that suggest data may soon be transmitted within chips at the speed of light.
1991,"Dr Mario Paniccia, the director of Intel's photonics technology lab, stated that they have surpassed a fundamental limit."
1992,"Approximately 20,000 individuals have been prohibited from accessing the Half-Life 2 game."
1993,"Half-Life 2 was officially released on 16 November, but before players could start playing the highly anticipated game, they had to authenticate their copy online."
1994,Some forum contributors were concerned that the action could lead to increased piracy as individuals attempted to acquire multiple copies of the game to stay ahead of Valve's anti-piracy measures.
1995,US magazine Mobile PC has selected the Apple Powerbook 100 as the greatest gadget of all time.
1996,The magazine stated that typically only items with potential mobility were included.
1997,Sony's third ranked item in the top 20 is the CDP-101 CD player from 1983.
1998,How about the magnetic compass? It is still in use a millennium after its invention.
1999,"In my opinion, my top 'true' gadgets are likely my portable MiniDisc player and the small battery-operated gadget I use to froth my coffee."
2000,There is no doubt that the Swiss army knife is a versatile tool.
2001,How about the Soda Stream.
2002,"Why be concerned about mobile phones when they will soon be integrated into PDAs/laptops, etc."
2003,The Sony Net Minidisc was a trailblazer that led to the proliferation of more mp3 players in the market.
2004,The Sinclair Executive was the first pocket calculator in the world.
2005,Are the individuals responsible for compiling this list crazy?
2006,A fascinating compilation.
2007,The mobile phone must be the one.
2008,"In 1980, the Casio pocket calculator, which featured a basic game and emitted small sounds, was a popular gadget."
2009,The Sinclair QL was a cutting-edge machine ahead of its time.
2010,"Complete nonsense. Yes, the Apple laptop and Sony Walkman are iconic devices."
2011,How did a laptop surpass the competition from wristwatches and telephones (mobile or otherwise)?
2012,The Psion Organiser series 3 should be considered top-tier due to its practical features and innovative design.
2013,The Motorola Startac deserves to be ranked as the top choice.
2014,"Without this little beauty, the Sinclair Spectrum, I would never have entered the field of IT and be earning the living that I do now."
2015,The Sinclair Spectrum - 16k connected to the television.
2016,"Apple, congratulations on a well-deserved victory!"
2017,"With a critical mass of individuals now embracing digital TV, DVDs, and digital video recorders, the next TV revolution is being prepared for our sets."
2018,"According to John Binks, director of GfK, which monitors global consumer markets, the UK is the largest display market in Europe."
2019,"Preparations are already in progress for the analogue switch-off in certain regions, and programmes are being recorded using HD cameras."
2020,"Starting next month, all devices that meet the necessary requirements for connectors and resolution will be labeled as ""HD-Ready."""
2021,A European Parliament committee has mandated a revision of the proposals for controversial new European Union rules governing computer-based inventions.
2022,Those against the draft directive were pleased with the decision and believed that a new first reading of the proposals would allow for more comprehensive discussions on its implications across all member states.
2023,"According to a report by analysts Forrester Research, the global personal computer count is projected to reach 1.3 billion by 2010, doubling from the current number."
2024,The $1.75 billion (Â£900 million) agreement will position the merged operation as the third largest PC vendor worldwide.
2025,"According to two reports, mobile devices are not yet capable of replacing portable media players as all-singing, all-dancing multimedia devices."
2026,"Half of the European population indicated that the size of a mobile phone was the most crucial factor in selecting their device, but larger handsets are often required due to increased power demands."
2027,"Globally, there are various standards and methods being developed to deliver TV signals to mobile devices."
2028,"T-Mobile's latest ""pocket office"" third-generation (3G) device with built-in wi-fi offers high-speed wireless net access."
2029,"T-Mobile announced that, in response to demand, it would be adding the latest phone-shaped Blackberry to its mobile range."
2030,"By keeping a continuous data connection throughout the journey, we can provide this service."
2031,A growing number of companies are providing web storage options for individuals with digital photo collections.
2032,"A place where pictures can be stored, shared with families and friends, and printed out."
2033,"The software offers tools for enhancing images by restoring color, eliminating red eye, and sharpening them."
2034,Ofcom has stated that the merging of TV and the internet is prompting questions about regulation.
2035,"He mentioned that the challenge will arise when the boundaries between TV and the internet truly blur, and then there is a balance to be struck between protecting consumers and allowing them to assess the risks themselves."
