,Text
0,Tony Blair has expressed his apologies to two families who experienced one of the UK's most significant miscarriages of justice.
1,The families had anticipated that the apology would be delivered during Prime Minister's Questions in the House of Commons.
2,She stated that those who had doubts about us should now accept that we were completely innocent.
3,The Tories have accused Labour of reneging on its pre-election immigration promise even before the ink has dried on its new pledge card.
4,London's Evening Standard reported that Mr Clarke expressed his desire for Britain to provide refuge for those escaping tyranny during a question and answer session with Labour activists in Gateshead.
5,"Dr. Fox informed journalists on Monday that the prime minister has a history of breaking promises, with the latest ones not even lasting a week."
6,"Mr Clarke emphasized that the UK would welcome genuine economic migrants for key jobs through a strict points-based system, with only asylum seekers genuinely fleeing death or persecution being admitted."
7,"Public trust in taxes is deteriorating due to the lack of transparency from both Labour and Tories on the issue, according to Lib Dem leader Charles Kennedy."
8,"Mr Kennedy emphasized the importance of economic credibility for a political party during his speech at the Commonwealth Club, stressing the need for budgets to be balanced and tough decisions to be made regarding public spending."
9,"According to the Liberal Democrats, the Conservatives have merely presented potential options for tax cuts to generate attention, while Labour has concealed most of its planned tax increases."
10,Tony Blair stated that voters will need to wait for Labour's manifesto to determine if the party intends to increase taxes.
11,Their plans for reduced government borrowing and increased spending on key services were also detailed.
12,The Conservative Party is set to support contentious government proposals for the implementation of ID cards.
13,"According to sources within the Conservative Party, the scheme has been described as ""deeply flawed"" and a waste of money."
14,"Mark Oaten, the Liberal Democrat home affairs spokesman, expressed his belief that Michael Howard was disregarding the concerns of his colleagues regarding ID cards."
15,"Britain must undergo a significant shift in direction to thrive, according to the shadow chancellor at the start of the Tory Party spring conference."
16,"""Is it possible for this country to compete and prosper without addressing the burden of regulation and tax on our economy?"" he inquired."
17,Downing Street announced that Britain has proposed sending a unit of 120 Gurkhas to support the tsunami relief operation in Indonesia.
18,"Nevertheless, a spokesperson highlighted the specific logistical challenges in Indonesia that the Gurkhas could potentially assist with."
19,"The prime minister, wearing a life jacket, sailed in a dinghy with school children to promote his party's education policies."
20,He later stated that outdoor activities were beneficial for children but acknowledged that many teachers now have concerns about participating due to the fear of potential lawsuits if something goes wrong.
21,Parents and teachers who attended the informal discussion with Mr. Blair on Tuesday had been invited after contacting their MPs to express concerns about education.
22,Archbishop Desmond Tutu has urged for the release of the remaining inmates at Guantanamo Bay and terror suspects detained without trial in the UK.
23,"Moazzam Begg, a resident of Birmingham, along with Martin Mubanga, Richard Belmar, and Feroz Abbasi, all from London, have been detained by the US at Guantanamo Bay for nearly three years."
24,"Archbishop Tutu expressed his disapproval of the measures, stating: ""I am against any arbitrary detention that is taking place, even in Britain."""
25,Tory leader Michael Howard has announced that the Conservative Party plans to reduce the number of MPs by approximately one-fifth if they win the election.
26,Mr Howard informed the paper that the changes would occur within five years of the Conservatives winning a general election.
27,"Mr Howard stated that the plan would address the ""great unfairness"" of the disproportionate number of Scottish and Welsh MPs compared to those from England by equalizing representation at Westminster."
28,Ministers are considering the possibility of electronically tagging parents who refuse to allow former partners contact with their children.
29,"Parenting plans offer guidance on access arrangements, drawing from successful real-life examples."
30,"Improved access to legal, emotional, and practical guidance through phone and internet services."
31,"A spokesman mentioned that judges have the ability to imprison parents who violate contact orders, but this was considered a last resort and rarely utilized due to not being in the child's best interests."
32,Fathers' rights groups have expressed disapproval of the government's proposals.
33,The Conservatives are pushing for a legal requirement for an equal split in parental access.
34,New regulations regarding marriage for foreign nationals residing in the UK will soon be implemented.
35,"Starting from Tuesday, all non-EU nationals, except citizens of Switzerland, Liechtenstein, Iceland, or Norway, who plan to marry in the UK must either obtain a visa for marriage before entering the country or apply for a Home Office 'certificate of marriage approval'."
36,"In some instances, the Home Secretary may act as a last-resort marriage registrar under these regulations."
37,Pro-hunt Members of Parliament claim that the new law prohibiting hunting with dogs is so badly written that no one can determine what constitutes an offense.
38,"Giles Bradshaw, a North Devon landowner, got in touch with the Middle Way Group, co-chaired by Mr. Opik, after reaching out to Defra, the rural affairs ministry, regarding the legality of his method of using dogs to scare off deer and foxes under the Hunting Act."
39,"The government is eager to leave behind this disastrous law, but I have serious doubts that the countryside will be so willing to cooperate."
40,The top judge in the UK has disclosed that he has had disagreements with ministers regarding the selection process for the heads of public inquiries.
41,"According to the government, it is unlikely that the lord chancellor would go against Lord Woolf's wishes."
42,"Lord Woolf stated that although the current rules were not formally documented, it was practically unimaginable for the lord chancellor to disregard his concerns."
43,"This week, ITV1's Pop Idol style talent contest for aspiring politicians, called Vote For Me, will finally be shown on our screens."
44,"Mr Bell, who is set to provide guidance to the contestants on Wednesday, contends that Westminster has its fair share of ""odd balls"" and the show will involve ordinary voters."
45,The participants had 60 seconds to present their manifestos before the final 25 were evaluated on their lobbying skills.
46,Mr Lim later had the panel in fits of giggles when he described his plan to have people do community service instead of paying taxes.
47,"Tony Blair's opinion is that abortion should not be a topic for elections, as he believes it is a personal matter of conscience."
48,Mr Blair's spokesperson stated that the Catholic church's stance on this issue is well-known and should be considered in the context of the Cardinal's overall message.
49,"During the Cosmopolitan interview, Mr Howard expressed his belief that abortion should be accessible to all, but he advocated for a change in the law."
50,The Conservatives have revealed their plans to eliminate 162 quangos in an attempt to demonstrate how government bureaucracy can be reduced.
51,"The plans aim to eliminate regional assemblies and other regional bodies, transferring their powers back to elected local councils or the national government."
52,"As part of its efficiency initiative, the government has revealed intentions to reduce the number of civil servants by 100,000."
53,It has been confirmed that the Labour Party will host its 2006 autumn conference in Manchester instead of Blackpool.
54,"The main political parties have been rotating between Blackpool, Bournemouth, and Brighton for years."
55,"One of Labour's most senior Asians, Shahid Malik, rejected a call for ethnic minority shortlists to increase the number of black and Asian MPs."
56,"Mr Phillips suggested that modifications to the race relations legislation could potentially enable political parties to reserve seats for under-represented groups, such as women and minorities in areas like West Ham."
57,The Green Party is worried that numerous residents in Edinburgh might not have the opportunity to vote in the transport referendum due to concerns about the edited electoral register.
58,"For those who are not on the list, there is still an opportunity to contact the council and ensure they receive ballot forms before the voting deadline in February."
59,The Liberal Democrats are trying to attract female voters by introducing their manifesto for women.
60,"He argues that pensions should not be based solely on the number of years worked, as this ignores the contribution women make caring for children."
61,Party strategists consider winning the support of a significant number of female voters crucial for achieving electoral success.
62,"Michael Howard, the leader of the Tory party, has taken a proactive approach in response to criticism about how a son of immigrants can advocate for asylum quotas."
63,"Michael Cockerell, a documentary maker, was granted exclusive access to Mr. Howard for his film portrait."
64,"Ms Robinson, who hosts The Weakest Link, expressed her dismay to Cockerell about his tough image during his time as home secretary in John Major's government."
65,"Michael Howard's documentary, ""No More Mr Nasty,"" will air on BBC2 on Saturday, February 12th at 2005 GMT."
66,"The lord chancellor stated that the concessions made on a bill criticized for potentially permitting euthanasia ""through the back door"" were not a political maneuver."
67,The legislation enables individuals to grant someone else the authority to make decisions on their behalf in case they are unable to do so due to illness.
68,"The government successfully defeated a backbench attempt to amend the bill on Tuesday by 297 votes to 203, despite opposition from 34 Labour MPs."
69,The attorney general refuted the claim that his statement to Parliament on the legality of the Iraq war was prepared by Downing Street officials.
70,Lord Goldsmith stated that he was actively involved in the drafting process and personally finalized and approved the answer.
71,"At his monthly news conference in Downing Street, Tony Blair stated that the attorney general's advice had been a ""fair summary"" of his opinion, echoing Lord Goldsmith's own words."
72,"The claims regarding Lord Falconer and Baroness Morgan's involvement were detailed in a book released this week by Philippe Sands QC, a member of Cherie Blair's Matrix Chambers."
73,"MPs have stated that due to government failures, thousands of public bodies are not ready for the Freedom of Information Act, which will be enforced next month."
74,"The Act will take effect in England, Wales, and Northern Ireland on 1 January, with similar measures being introduced in Scotland at the same time."
75,"New Yorker Dick Morris is undeniably a winner, according to any standard."
76,"Why did Morris choose Britain and UKIP, a party that, despite its recent success in the EU elections, is unlikely to achieve a remarkable victory in the upcoming general election?"
77,"He is on a mission to assist UKIP in leading Britain out of this organization, which he views as unchangeable and fundamentally undemocratic."
78,"Not only was it to shift the Tories, but I believe UKIP played a significant role in Tony Blair's decision to hold a referendum on the European constitution and his refusal to join the euro."
79,He proposes that this could result in a hung parliament where UKIP and other parties have significant influence.
80,Tony Blair has promised not to criticize Tory leader Michael Howard for his Jewish beliefs.
81,"One poster showed Mr Howard and his shadow chancellor Oliver Letwin, who is also Jewish, depicted as flying pigs."
82,"Mr Blair defended his party's stance towards the Jewish community, highlighting that his government had established the Holocaust Memorial Day."
83,"William Hague, the former Conservative leader, has stated that he will not run for leadership again, as he has abandoned his aspiration to become prime minister."
84,"He informed the newspaper that he is unsure if he will return to the front, but asked not to be rushed."
85,"Anglers and fishermen may face prosecution due to efforts to combat animal cruelty, cautioned a committee of MPs."
86,"A ""cast-iron guarantee"" was requested to ensure that the government consults on any plans to regulate animal industries like pet fairs and game bird rearing."
87,The committee emphasized the need for an amendment to prevent cases from being brought.
88,"The committee of MPs and peers has issued a warning that the number of deaths in custody has reached ""shocking"" levels."
89,The report stated that a significant number of individuals who later committed suicide had already sought help from authorities for their issues before engaging in any criminal behavior.
90,"""Throughout our investigation, we have consistently observed that individuals with significant vulnerabilities, such as mental health issues, substance abuse problems, and suicidal tendencies, are being placed in custody."""
91,"Nicholas Betts-Green, a potential candidate for the UK Independence Party (UKIP), has stepped down after acknowledging a ""brief association"" with the British National Party (BNP)."
92,"Tessa Jowell, the Secretary of State for Culture, Media and Sport, criticized the Gambling Bill's critics in an interview with the Guardian newspaper, clarifying that there would be no ""Las Vegas-style"" super-casinos as rumored in the press."
93,"During her interview with the newspaper, Ms Jowell expressed her dissatisfaction with the ""scale of misrepresentation"" in the media regarding the bill, which was her first interview since its launch."
94,Michael Howard has rejected concerns from certain Conservatives that his proposals for ÃÂ£4bn tax cuts are too modest.
95,"Edward Leigh, a Tory backbencher, expressed that the proposals were a positive step forward, but he emphasized to the Financial Times his preference for greater tax cuts to be implemented sooner."
96,"The most recent Conservative proposals were announced as the election campaign, expected to take place in May, gained momentum."
97,The Standards Board is currently conducting an inquiry into accusations that Ken Livingstone has tarnished his position.
98,"Bob Neill, leader of the London Assembly Conservatives, expressed his disappointment with the Mayor's conduct, stating that it was unbecoming of his office and showed extremely poor civic leadership."
99,Tony Blair has refuted reports suggesting he informed Gordon Brown that he would resign before the upcoming general election.
100,The issues concerning the country are what both of us are actually focusing on.
101,Mr Peston informed BBC News that the relationship between the two individuals is not as close or friendly as it used to be.
102,"Michael Howard, the Tory leader, accused the prime minister and Mr Brown of engaging in ""childish arguments""."
103,"According to a new book about the chancellor, Tony Blair assured Gordon Brown that he would step down before the next election."
104,"According to the author's sources, described as ""allies"" of Mr Blair and Mr Brown, the prime minister believed that the Iraq war had weakened his position and made him a liability to the Labour Party."
105,Mr Peston informed BBC News that he believes their relationship is not as close or friendly as it used to be.
106,The Labour MP for Birkenhead questioned the example set for the nation when the two most important political leaders engage in constant conflict or delegate their aides to do so.
107,Jack Straw stated that Britain's £3bn EU rebate will not be renegotiated at the upcoming European Council summit.
108,The foreign secretary informed the Commons foreign affairs committee that the UK's position is clear and non-negotiable.
109,"Lord Callaghan, the former Labour prime minister, died at his home in East Sussex just before his 93rd birthday."
110,Chancellor Gordon Brown expressed that the former PM would be mourned globally.
111,"Without him, the Labour party and the country will be poorer, said Conservative peer Lord Heseltine."
112,"Under pressure from the declining value of sterling, he resisted devaluation for three years before being compelled to do so in 1967."
113,His political career was frequently marked by conflicts with the radical left wing of the party.
114,The Law Lords have ruled that the immigration rules of the government discriminated against Roma (Gypsies) seeking entry into the UK.
115,"The airport screening in July 2001, during a period of concern over the influx of asylum seekers into Britain, resulted in those denied ""pre-clearance"" being effectively barred from traveling to the UK due to airlines refusing to carry them."
116,"According to Liberty, statistics indicated that Roma Czechs were 400 times more likely to be stopped by British immigration officials at Prague airport than non-Roma Czechs."
117,"In response to the ruling, a spokesperson from the Home Office stated that the scheme was implemented two years ago as a temporary measure due to the high number of passengers traveling from Prague who were later found ineligible for entry into the UK."
118,"According to MPs, visa processing staff are sometimes required to make a decision on an application every 11 minutes."
119,The committee's report also addressed the scandal involving Romanian and Bulgarian visas that resulted in the resignation of immigration minister Beverley Hughes last year.
120,"Sir Anthony Meyer, the Tory backbencher who ran against Margaret Thatcher for the party leadership in 1989, has passed away."
121,"A Conservative election challenger is stepping down after expressing a desire for a ""period of creative destruction in the public services""."
122,The party stated that the comment was taken out of context.
123,Chancellor Gordon Brown of the UK has pledged £960m ($1.8bn) over 15 years to an international program focused on enhancing vaccination and immunization efforts.
124,The chancellor spoke at an event co-organized by the UK's Department for International Development and the UN Development Programme on Wednesday.
125,"Michael Howard promised to champion the ""forgotten majority"" as he revealed the initial segment of the Conservative election manifesto."
126,"Campaigning for the general election is picking up pace, with expectations pointing towards May as the likely month, though it could also take place before June 2006."
127,"Mr Howard is calling for a change in direction in Britain, stating that the government is too large and cannot continue with increasing taxes."
128,"Labour's election slogan is: ""Britain's working, don't let the Tories wreck it again""."
129,The government refutes claims that Gordon Brown is getting ready to remove Alan Milburn as Labour's election chief.
130,Many Labour backbenchers are reportedly unhappy with the way election campaigning has unfolded and have expressed a desire for the chancellor to assume a more prominent role.
131,Speaker Michael Martin has ruled that MPs will be ejected from the Commons if they use Blackberries in the chamber.
132,"For a while now, the use of electronic devices in the Commons chamber has been disapproved of."
133,Accusations have been made against Labour for using anti-Semitic images in posters that some critics say portray Tory leader Michael Howard as Fagin.
134,The comparison between the hypnotism poster and the portrayal of the Dickens character Fagin in the stage version of the musical Oliver has sparked controversy.
135,"Among a series of ideas presented to Labour members for selection before the election, the poster is one of them."
136,MPs have stated that divorced parents trying to gain access to their children are frequently at a disadvantage due to the legal system.
137,"At present, it is assumed that the child's interests are the most important."
138,"Despite the courts' efforts to avoid conscious bias, there is significant evidence suggesting that non-resident parents are often disadvantaged by the current system."
139,"Mahmoud Abbas, the Palestinian leader, stated that he will not tolerate attacks like the recent suicide bombing in Tel Aviv, Israel."
140,"In an email interview with the British newspaper the Independent, Mr Abbas expressed his belief that peace is achievable now and that they are prepared to engage in negotiations with Israel to achieve a genuine and enduring peace based on justice and international legitimacy."
141,Tony Blair has reassured Labour backbenchers that nothing will hinder the party's pursuit of a third term in power.
142,Labour MPs gearing up to defend their seats in an upcoming election are increasingly concerned about the potential impact of damaging speculation.
143,Mr Blair's spokesman stated on Monday that the prime minister is committed to continuing the government's work as he understands it is what the people desire.
144,"In June 2004, he changed his mind after Cabinet allies intervened and he suspected the chancellor was plotting against him."
145,"""Royal Mail is currently investigating the disappearance of hundreds of ballot papers for the regional assembly referendum in the North East, causing voting packs to not reach about 300 homes in County Durham."""
146,"According to a Royal Mail representative, an issue with the delivery route in the Mowden area of Darlington is currently under investigation."
147,"Ministers are instructing councils to identify additional locations for travellers, amidst ongoing disputes over a series of unauthorized encampments."
148,Ms Cooper stated that there are currently two main issues in the planning system regarding Gypsy and traveller sites.
149,"Tony Blair criticized the Conservative spending plans, calling them a ""ludicrous improbability""."
150,"He stated that the Tory plans represent a clear invitation to return to the past, as evident as can be imagined."
151,Gordon Brown spoke at the conference in private.
152,"Michael Howard, the Tory leader, has refuted claims that his immigration policy was overlapping with that of the British National Party (BNP)."
153,"The Conservatives have pledged to set a maximum number of people allowed to enter Britain with the message: ""Imposing limits on immigration is not racist."""
154,"Pensioners are being assured energy savings by the Liberal Democrats, as snow and cold temperatures persist."
155,A report suggests that reducing the drink-drive limit by a third could save more lives than previously estimated.
156,"An earlier calculation, found in a 1998 Department of Transport Document, indicated that such a change could potentially save 50 lives annually."
157,Parliamentarians must carefully consider this matter.
158,"Howard Flight, the MP who was dismissed, will not be the candidate for his local Conservative association in the upcoming general election, as confirmed by Russell Tanguay, the agent for Arundel and South Downs Tories."
159,The Tory headquarters has stated that he is unable to run as a Conservative candidate because he is no longer an approved candidate.
160,"During a press conference, Mr. Howard maintained that he had followed the party's regulations."
161,"Mr Howard has also suspended Slough's constituency Conservative association for its refusal to deselect its candidate, Mr Adrian Hilton, who was abandoned after suggesting that signing the Maastricht Treaty was an act of treason under John Major's government."
162,Michael Howard criticized the expensive and disorganized asylum system in Britain during Tony Blair's leadership.
163,"Mr Howard stated that Britain should accept its equitable portion of the world's ""authentic refugees""."
164,Some charities expressed concerns that refugees' lives could be endangered if they were denied entry once quotas were met.
165,"According to Lib Dem leader Charles Kennedy, Tony Blair needs to outline a suitable plan for leaving Iraq following the upcoming elections in the country."
166,He said that some believe the insurgency in Iraq is fueled by the mere presence of British and American troops.
167,Peace protestors have been unsuccessful in a significant appeal regarding police actions during the prevention of an anti-war demonstration shortly after the beginning of the Iraq war.
168,The police were pressuring Lord Chief Justice and Lord Justices Clarke and Rix to reverse the ruling that they had violated the protestors' human rights by detaining them in the coaches.
169,A former Home Office minister has proposed the establishment of an independent body to oversee UK immigration.
170,"He stated that within the next 20 years, one out of every three households will be a result of immigration."
171,"Jack Cunningham, a seasoned Labour MP and former Cabinet minister, has announced his intention to step down in the upcoming election."
172,"While Labour was in opposition for an extended period, Mr. Cunningham served in various shadow roles, such as foreign affairs, the environment, and as trade spokesman."
173,Tony Blair emphasized the significant impact of the deal between Turkey and the EU on global peace and security.
174,Mr Howard stated that Turkey's connection with the EU would serve as a valuable link between Europe and the rest of the world.
